{
  "slug": "cn-math-2022",
  "country": "CN",
  "name": "义务教育数学课程标准（2022年版）· 小学部分",
  "version": "2022",
  "publisher": "中华人民共和国教育部",
  "sourceUrl": "http://www.moe.gov.cn/srcsite/A26/s8001/202204/t20220420_619921.html",
  "textIncluded": false,
  "note": "只收编码 + 本项目自写的中文转述（summary）与印刷页码（page），不收课标原文。summary 已把同主题【学业要求】中的关键程度要求（如\"两步为主、不超过三步\"）并入相应条目。编码为本项目自定，非教育部官方编号：<学段>.<领域>.<主题>.<序号>，学段 S1/S2/S3，领域 NA 数与代数 / GG 图形与几何 / SP 统计与概率 / IP 综合与实践，主题 SY 数与运算 / SL 数量关系 / RC 图形的认识与测量 / WY 图形的位置与运动 / FL 数据分类 / SJ 数据的收集、整理与表达 / KN 随机现象发生的可能性 / ZT 主题活动 / XM 项目学习；序号对应课标【内容要求】中的 (1)(2)…；HX.* 为\"核心素养在小学阶段的主要表现\"（表1）。generic=true 表示该条是素养概括句，不对应具体知识。",
  "license": "编码与转述：CC BY-SA 4.0（与本数据集其余文本相同）；课标原文版权归属见 PROVENANCE.md",
  "pageOffset": 7,
  "stages": {
    "S1": {
      "name": "第一学段",
      "grades": "1-2年级",
      "ageLo": 6,
      "ageHi": 8
    },
    "S2": {
      "name": "第二学段",
      "grades": "3-4年级",
      "ageLo": 8,
      "ageHi": 10
    },
    "S3": {
      "name": "第三学段",
      "grades": "5-6年级",
      "ageLo": 10,
      "ageHi": 12
    },
    "HX": {
      "name": "小学阶段",
      "grades": "1-6年级",
      "ageLo": 6,
      "ageHi": 12
    }
  },
  "themePages": {
    "S1.NA": [
      18,
      20
    ],
    "S2.NA": [
      20,
      23
    ],
    "S3.NA": [
      23,
      27
    ],
    "S1.GG": [
      28,
      29
    ],
    "S2.GG": [
      29,
      32
    ],
    "S3.GG": [
      32,
      36
    ],
    "S1.SP": [
      37,
      38
    ],
    "S2.SP": [
      38,
      39
    ],
    "S3.SP": [
      39,
      41
    ],
    "S1.IP": [
      43,
      46
    ],
    "S2.IP": [
      46,
      49
    ],
    "S3.IP": [
      50,
      52
    ]
  },
  "topicCount": 92,
  "topics": [
    {
      "key": "cn-math-2022:HX.SG",
      "code": "HX.SG",
      "data": {
        "title": "数感",
        "summary": "对数与数量、数量关系及运算结果的直观感悟：会用数表示个数和顺序，能在简单真实情境中合理估算，体会简单的数量规律。",
        "stage": "小学阶段",
        "grades": "1-6年级",
        "domain": "核心素养",
        "theme": null,
        "kind": "核心素养",
        "page": 7
      },
      "ageLo": 6,
      "ageHi": 12
    },
    {
      "key": "cn-math-2022:HX.LG",
      "code": "HX.LG",
      "data": {
        "title": "量感",
        "summary": "对可测量属性及大小关系的直观感知：理解统一度量单位的必要性，会针对情境选择单位并换算，能估计度量结果、初步感知误差。",
        "stage": "小学阶段",
        "grades": "1-6年级",
        "domain": "核心素养",
        "theme": null,
        "kind": "核心素养",
        "page": 7
      },
      "ageLo": 6,
      "ageHi": 12
    },
    {
      "key": "cn-math-2022:HX.FH",
      "code": "HX.FH",
      "data": {
        "title": "符号意识",
        "summary": "感悟符号的数学功能：会用符号表示数量、关系和一般规律，知道用符号表达的运算规律和结论具有一般性。",
        "stage": "小学阶段",
        "grades": "1-6年级",
        "domain": "核心素养",
        "theme": null,
        "kind": "核心素养",
        "page": 8
      },
      "ageLo": 6,
      "ageHi": 12
    },
    {
      "key": "cn-math-2022:HX.YS",
      "code": "HX.YS",
      "data": {
        "title": "运算能力",
        "summary": "依据法则和运算律正确运算：明晰运算对象和意义，理解算理与算法的关系，能选择合理简洁的运算策略。",
        "stage": "小学阶段",
        "grades": "1-6年级",
        "domain": "核心素养",
        "theme": null,
        "kind": "核心素养",
        "page": 8
      },
      "ageLo": 6,
      "ageHi": 12
    },
    {
      "key": "cn-math-2022:HX.JH",
      "code": "HX.JH",
      "data": {
        "title": "几何直观",
        "summary": "用图表描述和分析问题：感知图形及其组成元素并按特征分类，能按描述画图，建立形与数的联系。",
        "stage": "小学阶段",
        "grades": "1-6年级",
        "domain": "核心素养",
        "theme": null,
        "kind": "核心素养",
        "page": 8
      },
      "ageLo": 6,
      "ageHi": 12
    },
    {
      "key": "cn-math-2022:HX.KJ",
      "code": "HX.KJ",
      "data": {
        "title": "空间观念",
        "summary": "对物体或图形的形状、大小和位置关系的认识：在实物与几何图形之间互相想象，描述方位、位置关系和图形的运动变化。",
        "stage": "小学阶段",
        "grades": "1-6年级",
        "domain": "核心素养",
        "theme": null,
        "kind": "核心素养",
        "page": 9
      },
      "ageLo": 6,
      "ageHi": 12
    },
    {
      "key": "cn-math-2022:HX.TL",
      "code": "HX.TL",
      "data": {
        "title": "推理意识",
        "summary": "对逻辑推理的初步感悟：从已知事实按规则推出结论，用简单的归纳或类比提出猜想，能有条理地解释自己和他人的解题过程。",
        "stage": "小学阶段",
        "grades": "1-6年级",
        "domain": "核心素养",
        "theme": null,
        "kind": "核心素养",
        "page": 9
      },
      "ageLo": 6,
      "ageHi": 12
    },
    {
      "key": "cn-math-2022:HX.SJ",
      "code": "HX.SJ",
      "data": {
        "title": "数据意识",
        "summary": "对数据意义和随机性的感悟：知道很多问题要先调查收集数据；同一件事每次收集的数据可能不同，但数据足够时能发现规律；同一组数据可以用不同方式表达。",
        "stage": "小学阶段",
        "grades": "1-6年级",
        "domain": "核心素养",
        "theme": null,
        "kind": "核心素养",
        "page": 9
      },
      "ageLo": 6,
      "ageHi": 12
    },
    {
      "key": "cn-math-2022:HX.MX",
      "code": "HX.MX",
      "data": {
        "title": "模型意识",
        "summary": "对数学模型普适性的初步感悟：知道一个数学模型可以解决一类问题，意识到大量现实问题都与数学有关。",
        "stage": "小学阶段",
        "grades": "1-6年级",
        "domain": "核心素养",
        "theme": null,
        "kind": "核心素养",
        "page": 10
      },
      "ageLo": 6,
      "ageHi": 12
    },
    {
      "key": "cn-math-2022:HX.YY",
      "code": "HX.YY",
      "data": {
        "title": "应用意识",
        "summary": "有意识地用数学的概念、原理和方法解释现实现象、解决实际问题，初步了解数学在其他学科中的应用。",
        "stage": "小学阶段",
        "grades": "1-6年级",
        "domain": "核心素养",
        "theme": null,
        "kind": "核心素养",
        "page": 10
      },
      "ageLo": 6,
      "ageHi": 12
    },
    {
      "key": "cn-math-2022:HX.CX",
      "code": "HX.CX",
      "data": {
        "title": "创新意识",
        "summary": "主动从生活、自然或科学情境中发现和提出数学问题，借助归纳和类比提出猜想并尝试验证，敢于探索开放性的问题。",
        "stage": "小学阶段",
        "grades": "1-6年级",
        "domain": "核心素养",
        "theme": null,
        "kind": "核心素养",
        "page": 11
      },
      "ageLo": 6,
      "ageHi": 12
    },
    {
      "key": "cn-math-2022:S1.NA.SY.01",
      "code": "S1.NA.SY.01",
      "data": {
        "title": "万以内数的意义",
        "summary": "在实际情境中理解万以内数的意义和数位的含义，能认、读、写万以内的数，知道算盘可以表示多位数。",
        "stage": "第一学段",
        "grades": "1-2年级",
        "domain": "数与代数",
        "theme": "数与运算",
        "kind": "内容要求",
        "page": 18,
        "examples": [
          "例1"
        ]
      },
      "ageLo": 6,
      "ageHi": 8
    },
    {
      "key": "cn-math-2022:S1.NA.SY.02",
      "code": "S1.NA.SY.02",
      "data": {
        "title": "比较万以内数的大小",
        "summary": "理解 <、=、> 的含义，会比较万以内数的大小，感悟相等与不等关系。",
        "stage": "第一学段",
        "grades": "1-2年级",
        "domain": "数与代数",
        "theme": "数与运算",
        "kind": "内容要求",
        "page": 18,
        "examples": [
          "例2",
          "例6"
        ]
      },
      "ageLo": 6,
      "ageHi": 8
    },
    {
      "key": "cn-math-2022:S1.NA.SY.03",
      "code": "S1.NA.SY.03",
      "data": {
        "title": "四则运算的意义",
        "summary": "在具体情境中了解加、减、乘、除的意义，感悟运算之间的关系：减法是加法的逆运算，乘法是相同加数相加的简便运算，除法是乘法的逆运算。",
        "stage": "第一学段",
        "grades": "1-2年级",
        "domain": "数与代数",
        "theme": "数与运算",
        "kind": "内容要求",
        "page": 18,
        "examples": [
          "例3"
        ]
      },
      "ageLo": 6,
      "ageHi": 8
    },
    {
      "key": "cn-math-2022:S1.NA.SY.04",
      "code": "S1.NA.SY.04",
      "data": {
        "title": "整数加减法",
        "summary": "探索加减法的算理与算法；学段末能熟练口算20以内加减法、口算简单的百以内加减法，会计算两位数和三位数的加减法。",
        "stage": "第一学段",
        "grades": "1-2年级",
        "domain": "数与代数",
        "theme": "数与运算",
        "kind": "内容要求",
        "page": 18
      },
      "ageLo": 6,
      "ageHi": 8
    },
    {
      "key": "cn-math-2022:S1.NA.SY.05",
      "code": "S1.NA.SY.05",
      "data": {
        "title": "表内乘除法",
        "summary": "探索乘除法的算理与算法，会简单的整数乘除法；学段末能熟练口算表内乘除法。",
        "stage": "第一学段",
        "grades": "1-2年级",
        "domain": "数与代数",
        "theme": "数与运算",
        "kind": "内容要求",
        "page": 18
      },
      "ageLo": 6,
      "ageHi": 8
    },
    {
      "key": "cn-math-2022:S1.NA.SY.06",
      "code": "S1.NA.SY.06",
      "data": {
        "title": "体会数与运算的意义",
        "summary": "在解决生活情境问题的过程中体会数和运算的意义，形成初步的符号意识、数感、运算能力和推理意识。",
        "stage": "第一学段",
        "grades": "1-2年级",
        "domain": "数与代数",
        "theme": "数与运算",
        "kind": "内容要求",
        "page": 18,
        "generic": true
      },
      "ageLo": 6,
      "ageHi": 8
    },
    {
      "key": "cn-math-2022:S1.NA.SL.01",
      "code": "S1.NA.SL.01",
      "data": {
        "title": "用数和运算解决简单问题",
        "summary": "在简单的生活情境中运用数和运算解决问题，并能解释结果的实际意义。",
        "stage": "第一学段",
        "grades": "1-2年级",
        "domain": "数与代数",
        "theme": "数量关系",
        "kind": "内容要求",
        "page": 19
      },
      "ageLo": 6,
      "ageHi": 8
    },
    {
      "key": "cn-math-2022:S1.NA.SL.02",
      "code": "S1.NA.SL.02",
      "data": {
        "title": "简单的变化规律",
        "summary": "探索用数或符号表达简单情境中的变化规律（如图形或数的排列规律）。",
        "stage": "第一学段",
        "grades": "1-2年级",
        "domain": "数与代数",
        "theme": "数量关系",
        "kind": "内容要求",
        "page": 19,
        "examples": [
          "例4",
          "例5"
        ]
      },
      "ageLo": 6,
      "ageHi": 8
    },
    {
      "key": "cn-math-2022:S1.GG.RC.01",
      "code": "S1.GG.RC.01",
      "data": {
        "title": "认识立体图形和平面图形",
        "summary": "通过实物和模型辨认长方体、正方体、圆柱、球和长方形、正方形、平行四边形、三角形、圆，能直观描述特征、简单分类，会用简单图形拼图，说出立体图形某个面的形状。",
        "stage": "第一学段",
        "grades": "1-2年级",
        "domain": "图形与几何",
        "theme": "图形的认识与测量",
        "kind": "内容要求",
        "page": 28,
        "examples": [
          "例24"
        ]
      },
      "ageLo": 6,
      "ageHi": 8
    },
    {
      "key": "cn-math-2022:S1.GG.RC.02",
      "code": "S1.GG.RC.02",
      "data": {
        "title": "长度单位米和厘米",
        "summary": "体会统一度量单位的必要性，认识长度单位米、厘米并会换算，能估测身边物体的长度并借助工具测量。",
        "stage": "第一学段",
        "grades": "1-2年级",
        "domain": "图形与几何",
        "theme": "图形的认识与测量",
        "kind": "内容要求",
        "page": 28,
        "examples": [